{
  "seed": 42,
  "generations": 3,
  "objectiveIds": [
    "abs_torque",
    "copper_iron_loss"
  ],
  "variableIds": [
    "magnet_thickness_m",
    "turns_per_phase"
  ],
  "fronts": [
    {
      "rank": 0,
      "indices": [
        0,
        1,
        2,
        3,
        4,
        5,
        6,
        7
      ]
    }
  ],
  "individuals": [
    {
      "id": "ind-0",
      "x": [
        0.003497171,
        36
      ],
      "f": [
        3.174654,
        72.470203
      ],
      "rank": 0,
      "feasible": true
    },
    {
      "id": "ind-1",
      "x": [
        0.003612264,
        36
      ],
      "f": [
        3.196779,
        72.926469
      ],
      "rank": 0,
      "feasible": true
    },
    {
      "id": "ind-2",
      "x": [
        0.00391828,
        36
      ],
      "f": [
        3.25057,
        74.032571
      ],
      "rank": 0,
      "feasible": true
    },
    {
      "id": "ind-3",
      "x": [
        0.00391828,
        36
      ],
      "f": [
        3.25057,
        74.032571
      ],
      "rank": 0,
      "feasible": true
    },
    {
      "id": "ind-4",
      "x": [
        0.00391828,
        36
      ],
      "f": [
        3.25057,
        74.032571
      ],
      "rank": 0,
      "feasible": true
    },
    {
      "id": "ind-5",
      "x": [
        0.00391828,
        36
      ],
      "f": [
        3.25057,
        74.032571
      ],
      "rank": 0,
      "feasible": true
    },
    {
      "id": "ind-6",
      "x": [
        0.003447145,
        37
      ],
      "f": [
        3.252588,
        74.228992
      ],
      "rank": 0,
      "feasible": true
    },
    {
      "id": "ind-7",
      "x": [
        0.00351526,
        37
      ],
      "f": [
        3.26649,
        74.508096
      ],
      "rank": 0,
      "feasible": true
    }
  ],
  "digest": {
    "paretoCount": 8,
    "fMin": [
      3.174654,
      72.470203
    ],
    "fMax": [
      3.26649,
      74.508096
    ]
  }
}
